{
  "schema_version": "1.0.0",
  "ingest_id": "11111111-1111-4111-8111-111111111111",
  "trace_id": "22222222-2222-4222-8222-222222222222",
  "dedup_key": "sha256:d3d14584795bec8703571725daab0415f11f139f9469d540e6f7f810b35724d1",
  "source_class": "dnm_dataset",
  "source_ref": "dataset://example/listings/example-1",
  "content_type": "json",
  "raw_content": "{\"dataset\":{\"name\":\"Synthetic contract example\"},\"listing\":{\"id\":\"example-1\",\"title\":\"Benign fixture\"},\"record_type\":\"market_listing\"}",
  "captured_at": "2026-07-16T12:00:00Z",
  "source_observed_at": "2014-01-22T00:00:00Z",
  "lang_hint": null,
  "geo_hints": [],
  "crawl_metadata": {
    "source_item_id": "example-1",
    "status_code": null,
    "latency_ms": null,
    "retries": 0,
    "proxy_instance": null
  },
  "source_metadata": {
    "fixture": true
  },
  "evidence": {
    "hash_algorithm": "sha256",
    "source_sha256": "43b060ba28b236cace748b54bc1ad13a54b1950e6054dee7a70f975f63fcfd89",
    "content_sha256": "e5a58a99d28633dc1818efdd97bef5559acfb13e9c0b27d228153f1d0d36c288",
    "source_size_bytes": 43,
    "content_size_bytes": 134,
    "captured_at": "2026-07-16T12:00:00Z",
    "collector_id": "example",
    "collector_version": "0.1.0"
  },
  "safety": {
    "status": "accepted",
    "policy_version": "prepublish-v1",
    "checks": [
      "content_type:text_only",
      "mime_type:allowlist",
      "size_limits",
      "source_policy",
      "blocked_source_hash",
      "binary_persistence:false"
    ],
    "binary_content_stored": false
  }
}
